{
  "name": "Webster's Bible Translation",
  "version": "WEBSTER",
  "language": "english",
  "language_code": "en",
  "edition_year": 1833,
  "publisher_source": "eBible Corpus (BibleNLP/ebible)",
  "license": "Public Domain",
  "source_url": "https://raw.githubusercontent.com/BibleNLP/ebible/main/corpus/eng-engwebster.txt",
  "download_date": "2026-08-16",
  "checksum_hash": "4b0abc03091449d8ca8de827927b35fd2f401af64ea0213d44647a072759b2a8",
  "coverage": {
    "books_count": 66,
    "chapters_count": 1188,
    "verses_count": 30966,
    "testaments": [
      "nt",
      "ot"
    ]
  }
}